[
  {
    "id": "add-image-watermark",
    "studio": "image",
    "mode": "i2i",
    "muapiId": "add-image-watermark",
    "runwareCatalogId": null,
    "runwareAir": null,
    "parityClass": "TBD",
    "taskType": "imageInference",
    "taskProfile": "image-i2i",
    "pickerSurface": "unified",
    "adapterOp": "imageI2i",
    "docUrl": null,
    "verifiedLive": false,
    "verifiedAt": null,
    "exemptionReason": null
  },
  {
    "id": "ai-anime-generator",
    "studio": "image",
    "mode": "t2i",
    "muapiId": "ai-anime-generator",
    "runwareCatalogId": null,
    "runwareAir": null,
    "parityClass": "B",
    "taskType": "tiInference",
    "taskProfile": "image-standard",
    "pickerSurface": "unified",
    "adapterOp": "imageT2i",
    "docUrl": null,
    "verifiedLive": false,
    "verifiedAt": null,
    "exemptionReason": "Muapi-exclusive or no Runware equivalent documented"
  },
  {
    "id": "ai-background-remover",
    "studio": "image",
    "mode": "i2i",
    "muapiId": "ai-background-remover",
    "runwareCatalogId": null,
    "runwareAir": null,
    "parityClass": "B",
    "taskType": "iiInference",
    "taskProfile": "image-i2i",
    "pickerSurface": "legacy",
    "adapterOp": "imageI2i",
    "docUrl": null,
    "verifiedLive": false,
    "verifiedAt": null,
    "exemptionReason": "Muapi-exclusive or no Runware equivalent documented"
  },
  {
    "id": "ai-color-photo",
    "studio": "image",
    "mode": "i2i",
    "muapiId": "ai-color-photo",
    "runwareCatalogId": null,
    "runwareAir": null,
    "parityClass": "B",
    "taskType": "iiInference",
    "taskProfile": "image-i2i",
    "pickerSurface": "legacy",
    "adapterOp": "imageI2i",
    "docUrl": null,
    "verifiedLive": false,
    "verifiedAt": null,
    "exemptionReason": "Muapi-exclusive or no Runware equivalent documented"
  },
  {
    "id": "ai-dress-change",
    "studio": "image",
    "mode": "i2i",
    "muapiId": "ai-dress-change",
    "runwareCatalogId": null,
    "runwareAir": null,
    "parityClass": "B",
    "taskType": "iiInference",
    "taskProfile": "image-i2i",
    "pickerSurface": "legacy",
    "adapterOp": "imageI2i",
    "docUrl": null,
    "verifiedLive": false,
    "verifiedAt": null,
    "exemptionReason": "Muapi-exclusive or no Runware equivalent documented"
  },
  {
    "id": "ai-ghibli-style",
    "studio": "image",
    "mode": "i2i",
    "muapiId": "ai-ghibli-style",
    "runwareCatalogId": null,
    "runwareAir": null,
    "parityClass": "B",
    "taskType": "iiInference",
    "taskProfile": "image-i2i",
    "pickerSurface": "legacy",
    "adapterOp": "imageI2i",
    "docUrl": null,
    "verifiedLive": false,
    "verifiedAt": null,
    "exemptionReason": "Muapi-exclusive or no Runware equivalent documented"
  },
  {
    "id": "ai-image-extension",
    "studio": "image",
    "mode": "i2i",
    "muapiId": "ai-image-extension",
    "runwareCatalogId": null,
    "runwareAir": null,
    "parityClass": "B",
    "taskType": "iiInference",
    "taskProfile": "image-i2i",
    "pickerSurface": "legacy",
    "adapterOp": "imageI2i",
    "docUrl": null,
    "verifiedLive": false,
    "verifiedAt": null,
    "exemptionReason": "Muapi-exclusive or no Runware equivalent documented"
  },
  {
    "id": "ai-image-face-swap",
    "studio": "image",
    "mode": "i2i",
    "muapiId": "ai-image-face-swap",
    "runwareCatalogId": null,
    "runwareAir": null,
    "parityClass": "B",
    "taskType": "iiInference",
    "taskProfile": "image-i2i",
    "pickerSurface": "legacy",
    "adapterOp": "imageI2i",
    "docUrl": null,
    "verifiedLive": false,
    "verifiedAt": null,
    "exemptionReason": "Muapi-exclusive or no Runware equivalent documented"
  },
  {
    "id": "ai-image-upscaler",
    "studio": "image",
    "mode": "i2i",
    "muapiId": "ai-image-upscaler",
    "runwareCatalogId": null,
    "runwareAir": null,
    "parityClass": "B",
    "taskType": "iiInference",
    "taskProfile": "image-i2i",
    "pickerSurface": "legacy",
    "adapterOp": "imageI2i",
    "docUrl": null,
    "verifiedLive": false,
    "verifiedAt": null,
    "exemptionReason": "Muapi-exclusive or no Runware equivalent documented"
  },
  {
    "id": "ai-object-eraser",
    "studio": "image",
    "mode": "i2i",
    "muapiId": "ai-object-eraser",
    "runwareCatalogId": null,
    "runwareAir": null,
    "parityClass": "B",
    "taskType": "iiInference",
    "taskProfile": "image-i2i",
    "pickerSurface": "legacy",
    "adapterOp": "imageI2i",
    "docUrl": null,
    "verifiedLive": false,
    "verifiedAt": null,
    "exemptionReason": "Muapi-exclusive or no Runware equivalent documented"
  },
  {
    "id": "ai-product-photography",
    "studio": "image",
    "mode": "i2i",
    "muapiId": "ai-product-photography",
    "runwareCatalogId": null,
    "runwareAir": null,
    "parityClass": "B",
    "taskType": "iiInference",
    "taskProfile": "image-i2i",
    "pickerSurface": "legacy",
    "adapterOp": "imageI2i",
    "docUrl": null,
    "verifiedLive": false,
    "verifiedAt": null,
    "exemptionReason": "Muapi-exclusive or no Runware equivalent documented"
  },
  {
    "id": "ai-product-shot",
    "studio": "image",
    "mode": "i2i",
    "muapiId": "ai-product-shot",
    "runwareCatalogId": null,
    "runwareAir": null,
    "parityClass": "B",
    "taskType": "iiInference",
    "taskProfile": "image-i2i",
    "pickerSurface": "legacy",
    "adapterOp": "imageI2i",
    "docUrl": null,
    "verifiedLive": false,
    "verifiedAt": null,
    "exemptionReason": "Muapi-exclusive or no Runware equivalent documented"
  },
  {
    "id": "ai-skin-enhancer",
    "studio": "image",
    "mode": "i2i",
    "muapiId": "ai-skin-enhancer",
    "runwareCatalogId": null,
    "runwareAir": null,
    "parityClass": "B",
    "taskType": "iiInference",
    "taskProfile": "image-i2i",
    "pickerSurface": "legacy",
    "adapterOp": "imageI2i",
    "docUrl": null,
    "verifiedLive": false,
    "verifiedAt": null,
    "exemptionReason": "Muapi-exclusive or no Runware equivalent documented"
  },
  {
    "id": "ai-video-effects",
    "studio": "video",
    "mode": "i2v",
    "muapiId": "ai-video-effects",
    "runwareCatalogId": null,
    "runwareAir": null,
    "parityClass": "B",
    "taskType": "ivInference",
    "taskProfile": "video-i2v",
    "pickerSurface": "legacy",
    "adapterOp": "videoI2v",
    "docUrl": null,
    "verifiedLive": false,
    "verifiedAt": null,
    "exemptionReason": "Muapi-exclusive or no Runware equivalent documented"
  },
  {
    "id": "Api Node",
    "studio": "image",
    "mode": "i2i",
    "muapiId": "Api Node",
    "runwareCatalogId": null,
    "runwareAir": null,
    "parityClass": "TBD",
    "taskType": "imageInference",
    "taskProfile": "image-i2i",
    "pickerSurface": "unified",
    "adapterOp": "imageI2i",
    "docUrl": null,
    "verifiedLive": false,
    "verifiedAt": null,
    "exemptionReason": null
  },
  {
    "id": "bytedance-seededit-v3",
    "studio": "image",
    "mode": "i2i",
    "muapiId": "bytedance-seededit-v3",
    "runwareCatalogId": null,
    "runwareAir": null,
    "parityClass": "TBD",
    "taskType": "imageInference",
    "taskProfile": "image-i2i",
    "pickerSurface": "unified",
    "adapterOp": "imageI2i",
    "docUrl": null,
    "verifiedLive": false,
    "verifiedAt": null,
    "exemptionReason": null
  },
  {
    "id": "bytedance-seedream-edit-v4",
    "studio": "image",
    "mode": "i2i",
    "muapiId": "bytedance-seedream-edit-v4",
    "runwareCatalogId": "rw-seedream-5-lite-i2i",
    "runwareAir": "runware:seedream@5-lite",
    "parityClass": "A",
    "taskType": "imageInference",
    "taskProfile": "image-i2i",
    "pickerSurface": "unified",
    "adapterOp": "imageI2i",
    "docUrl": "https://runware.ai/docs/models/seedream-5-0-lite",
    "verifiedLive": false,
    "verifiedAt": null,
    "exemptionReason": null
  },
  {
    "id": "bytedance-seedream-v3",
    "studio": "image",
    "mode": "t2i",
    "muapiId": "bytedance-seedream-v3",
    "runwareCatalogId": "rw-seedream-5-lite",
    "runwareAir": "runware:seedream@5-lite",
    "parityClass": "A",
    "taskType": "imageInference",
    "taskProfile": "image-standard",
    "pickerSurface": "unified",
    "adapterOp": "imageT2i",
    "docUrl": "https://runware.ai/docs/models/seedream-5-0-lite",
    "verifiedLive": false,
    "verifiedAt": null,
    "exemptionReason": null
  },
  {
    "id": "bytedance-seedream-v4",
    "studio": "image",
    "mode": "t2i",
    "muapiId": "bytedance-seedream-v4",
    "runwareCatalogId": "rw-seedream-5-lite",
    "runwareAir": "runware:seedream@5-lite",
    "parityClass": "A",
    "taskType": "imageInference",
    "taskProfile": "image-standard",
    "pickerSurface": "unified",
    "adapterOp": "imageT2i",
    "docUrl": "https://runware.ai/docs/models/seedream-5-0-lite",
    "verifiedLive": false,
    "verifiedAt": null,
    "exemptionReason": null
  },
  {
    "id": "bytedance-seedream-v4.5",
    "studio": "image",
    "mode": "t2i",
    "muapiId": "bytedance-seedream-v4.5",
    "runwareCatalogId": "rw-seedream-5-lite",
    "runwareAir": "runware:seedream@5-lite",
    "parityClass": "A",
    "taskType": "imageInference",
    "taskProfile": "image-standard",
    "pickerSurface": "unified",
    "adapterOp": "imageT2i",
    "docUrl": "https://runware.ai/docs/models/seedream-5-0-lite",
    "verifiedLive": false,
    "verifiedAt": null,
    "exemptionReason": null
  },
  {
    "id": "bytedance-seedream-v4.5-edit",
    "studio": "image",
    "mode": "i2i",
    "muapiId": "bytedance-seedream-v4.5-edit",
    "runwareCatalogId": "rw-seedream-5-lite-i2i",
    "runwareAir": "runware:seedream@5-lite",
    "parityClass": "A",
    "taskType": "imageInference",
    "taskProfile": "image-i2i",
    "pickerSurface": "unified",
    "adapterOp": "imageI2i",
    "docUrl": "https://runware.ai/docs/models/seedream-5-0-lite",
    "verifiedLive": false,
    "verifiedAt": null,
    "exemptionReason": null
  },
  {
    "id": "chroma-image",